{
  "title": "Multi SWR check",
  "description": "Check the SWR for a set of frequencies",
  "script": "const FREQ_LIST = [\r\n\t7032000,\r\n\t14044000,\r\n\t21044000\r\n];\r\n\r\nconst MMINDEX_MAX_PA_V = 'MMProtection|Max. PA voltage';\r\nconst MMINDEX_SWR_PROTECTION = 'MMProtection|SWR protection';\r\nconst PA_V_TUNE = 4.50;\r\nconst PA_V_OPERATE = 11.5;\r\n\r\nconsole.log(\"Multi SWR Check\");\r\n\r\nlet vfo, mode, power, swrProtection;\r\n\r\nconst saveSettings = async () => {\r\n\t\r\n\t/*\r\n\t0-10 digits: IF frequency in Hz\r\n\t11-16 N/A (Spaces)\r\n\t17-22 RIT offset in Hz (signed)\r\n\t23 RIT status (0=off, 1=on)\r\n\t24 XIT status (0=off, 1=on)\r\n\t25-27 N/A\r\n\t28 TX Status (0=RX, 1=TX)\r\n\t29 MODE\r\n\t30 RX VFO (0=A, 1=B)\r\n\t31 N/A\r\n\t32 Split status (0=off, 1=on)\r\n\t33-34 N/A\r\n\t35 N/A (Space)\r\n\t*/\r\n\r\n\tconst rawIF = await sendCat(`IF;`);\r\n\tvfo = rawIF.substring(30,31) == \"0\" ? \"A\" : \"B\";\r\n\tmode = rawIF.substring(29,30);\r\n\r\n\tpower = (await sendCat(`${MMINDEX_MAX_PA_V};`)).substring(2);\r\n\tswrProtection = (await sendCat(`${MMINDEX_SWR_PROTECTION};`)).substring(2);\r\n\t//console.log(`SWR Protection saving state: ${swrProtection}`);\r\n\r\n}\r\n\r\nconst revertSettings = async () => {\r\n\tsendCat(`MD${mode};`, false);\r\n\tsendCat(`${MMINDEX_MAX_PA_V}=${PA_V_OPERATE};`, false);\r\n\tsendCat(`${MMINDEX_SWR_PROTECTION}=${swrProtection};`, false);\r\n\t\r\n\t//console.log(`SWR Protection reverting to: ${swrProtection}`);\r\n\r\n\t//let tmp = (await sendCat(`${MMINDEX_SWR_PROTECTION};`)).substring(2);\r\n\r\n\t//console.log(`SWR Protection saved: ${tmp}`);\r\n};\r\n\r\nconst getSWR = async () => {\r\n\t\r\n\tconst resultList = [];\r\n\tfor( let cI=0; cI<10; cI++) {\r\n\t\tconst raw = (await sendCat('SW;')).substring(2);\r\n\t\tlet val = raw / 100;\r\n\t\tresultList.push(val);\r\n\t}\r\n\r\n\tconst sum = resultList.reduce((acc, value) => acc + value, 0);\r\n\r\n\tconst avg = sum/10;\r\n\treturn avg.toFixed(1);\r\n};\r\n\r\nconst setBand = (freq) => {\r\n\tconst band = Math.floor(freq / 1000000);\r\n\treturn `${band} MHz`;\r\n};\r\n\r\nconst tuneSetup = async () => {\r\n\tawait saveSettings();\r\n\t\r\n\tsendCat(`${MMINDEX_MAX_PA_V}=${PA_V_TUNE};`, false);\r\n\tsendCat(`${MMINDEX_SWR_PROTECTION}=DISABLED;`, false);\r\n\tsendCat('MD6;', false); // FSK\r\n\r\n\t//let tmp = (await sendCat(`${MMINDEX_SWR_PROTECTION};`)).substring(2);\r\n\r\n\t//console.log(`SWR Protection set for tune: ${tmp}`);\r\n};\r\n\r\nconst txStart = () => {\r\n\tsendCat('TX;', false);\r\n\tsendCat('TA500;', false);\r\n\tdelay(6);\r\n};\r\n\r\nconst txStop = () => {\r\n\tsendCat('TA0;', false);\r\n\tdelay(6);\r\n\tsendCat('RX;', false);\r\n}\r\n\r\nconst freqList = FREQ_LIST;\r\n\r\nawait tuneSetup();\r\n\r\nsetDescription( \"Checking ...\" );\r\n\r\nconst swrList = [];\r\n\r\nfor( const freq of freqList ) {\r\n\tawait sendCat(`F${vfo}${freq};`, false);\r\n\tawait txStart();\r\n\tawait delay(100);\r\n\tconst swr = await getSWR();\r\n\tswrList.push({freq, swr });  \r\n\tawait txStop();\t\r\n}\r\n\r\nawait revertSettings();\r\n\r\nlet output = swrList.map( v=> {\r\n\treturn `${Math.round(v.freq/100)/10}: ${v.swr}`\r\n})\r\n.join(\" | \");\r\n\r\nsetDescription( output );",
  "autoRunOnConnect": false,
  "autoRunPriority": 0,
  "autoLock": false,
  "runLocked": false
}
