{
  "title": "Cycle AGC presets",
  "description": "",
  "script": "console.log(\"Cycle AGC script loaded\");\r\n\r\n/*\r\n\r\nMost details taken from \r\nhttps://groups.io/g/QRPLabs/topic/best_qmx_agc_settings/110439092\r\n\r\n*/\r\n\r\nconst AGC_LIST = [\r\n\t{\r\n\t\tname: \"QMX Default\",\r\n\t\tattribution: \"QRP Labs\",\r\n\t\tthresholdS: 8,\r\n\t\tslopeDbPerDb: 80,\r\n\t\tnoiseFilter: 10,\r\n\t\thangTime: 80,\r\n\t\tsmoothSamples: 50,\r\n\t\trecoveryDbPerSecond: 10,\r\n\t\tsampleBlocks: 2,\r\n\t\terrors: \"locked x1\"\r\n\t},\r\n\t{\r\n\t\tname: \"Baloo\",\r\n\t\tattribution: \"Rick - W5NR\",\r\n\t\tthresholdS: 7,\r\n\t\tslopeDbPerDb: 60,\r\n\t\tnoiseFilter: 5,\r\n\t\thangTime: 30,\r\n\t\tsmoothSamples: 50,\r\n\t\trecoveryDbPerSecond: 50,\r\n\t\tsampleBlocks: 2\r\n\t},\r\n\t{\r\n\t\tname: \"Gadget\",\r\n\t\tattribution: \"Dan - W2DLC\",\r\n\t\tthresholdS: 8,\r\n\t\tslopeDbPerDb: 65,\r\n\t\tnoiseFilter: 9,\r\n\t\thangTime: 55,\r\n\t\tsmoothSamples: 60,\r\n\t\trecoveryDbPerSecond: 8,\r\n\t\tsampleBlocks: 2\r\n\t},\r\n\t{\r\n\t\tname: \"Granny\",\r\n\t\tattribution: \"Ron\",\r\n\t\tthresholdS: 7,\r\n\t\tslopeDbPerDb: 95,\r\n\t\tnoiseFilter: 5,\r\n\t\thangTime: 50,\r\n\t\tsmoothSamples: 99,\r\n\t\trecoveryDbPerSecond: 40,\r\n\t\tsampleBlocks: 4\r\n\t},\r\n\t{\r\n\t\tname: \"Paddington\",\r\n\t\tattribution: \"K7VIQ\",\r\n\t\tthresholdS: 8,\r\n\t\tslopeDbPerDb: 80,\r\n\t\tnoiseFilter: 10,\r\n\t\thangTime: 80,\r\n\t\tsmoothSamples: 50,\r\n\t\trecoveryDbPerSecond: 10,\r\n\t\tsampleBlocks: 2\r\n\t},\r\n\t{\r\n\t\tname: \"Pingu\",\r\n\t\tattribution: \"Other\",\r\n\t\tthresholdS: 7,\r\n\t\tslopeDbPerDb: 60,\r\n\t\tnoiseFilter: 5,\r\n\t\thangTime: 30,\r\n\t\tsmoothSamples: 50,\r\n\t\trecoveryDbPerSecond: 50,\r\n\t\tsampleBlocks: 4\r\n\t},\r\n\t{\r\n\t\tname: \"Taz\",\r\n\t\tattribution: \"Steve - G4EDG\",\r\n\t\tthresholdS: 4,\r\n\t\tslopeDbPerDb: 50,\r\n\t\tnoiseFilter: 0,\r\n\t\thangTime: 2,\r\n\t\tsmoothSamples: 0,\r\n\t\trecoveryDbPerSecond: 60,\r\n\t\tsampleBlocks: 2,\r\n\t\terrors: \"locked x2\"\r\n\t},\r\n\t{\r\n\t\tname: \"Tom\",\r\n\t\tattribution: \"Chuck - WA3UQV\",\r\n\t\tthresholdS: 12,\r\n\t\tslopeDbPerDb: 80,\r\n\t\tnoiseFilter: 10,\r\n\t\thangTime: 80,\r\n\t\tsmoothSamples: 50,\r\n\t\trecoveryDbPerSecond: 10,\r\n\t\tsampleBlocks: 2\r\n\t},\r\n\t{\r\n\t\tname: \"Tweety\",\r\n\t\tattribution: \"KL7MJ\",\r\n\t\tthresholdS: 4,\r\n\t\tslopeDbPerDb: 80,\r\n\t\tnoiseFilter: 10,\r\n\t\thangTime: 30,\r\n\t\tsmoothSamples: 50,\r\n\t\trecoveryDbPerSecond: 10,\r\n\t\tsampleBlocks: 2\r\n\t},\r\n\t{\r\n\t\tname: \"User Defined 1\",\r\n\t\tattribution: \"\",\r\n\t\tthresholdS: 8,\r\n\t\tslopeDbPerDb: 80,\r\n\t\tnoiseFilter: 10,\r\n\t\thangTime: 80,\r\n\t\tsmoothSamples: 50,\r\n\t\trecoveryDbPerSecond: 10,\r\n\t\tsampleBlocks: 5\r\n\t},\r\n\r\n];\r\n\r\nconst getNext = (lastIndex, list) => {\r\n\tlet index = isNaN(lastIndex) ? -1 : lastIndex;\r\n\tindex = (index + 1) % list.length;\r\n\treturn index;\r\n};\r\n\r\nconst applyAGCSettings = (settings) => {\r\n\tconst prefix = \"MMAUDIO|AGC settings|\";\r\n\r\n\tsendCat(`${prefix}Threshold S=${settings.thresholdS};`, false);\r\n\tsendCat(`${prefix}Slope dB per dB=${settings.slopeDbPerDb};`, false);\r\n\tsendCat(`${prefix}Noise filter=${settings.noiseFilter};`, false);\r\n\tsendCat(`${prefix}Hang time=${settings.hangTime};`, false);\r\n\tsendCat(`${prefix}Smooth samples=${settings.smoothSamples};`, false);\r\n\tsendCat(`${prefix}Recovery db/s=${settings.recoveryDbPerSecond};`, false);\r\n\tsendCat(`${prefix}Sample blocks=${settings.sampleBlocks};`, false);\r\n};\r\n\r\n\r\nconst loadAGCSettingsFromRadio = async () => {\r\n\ttry {\r\n\t\tconst settings = {};\r\n\t\tconst prefix = \"MMAUDIO|AGC settings|\";\r\n\t\tsettings.thresholdS = await sendCat(`${prefix}Threshold S;`);\r\n\t\tsettings.slopeDbPerDb = await sendCat(`${prefix}Slope dB per dB;`);\r\n\t\tsettings.noiseFilter = await sendCat(`${prefix}Noise filter;`);\r\n\t\tsettings.hangTime = await sendCat(`${prefix}Hang time;`);\r\n\t\tsettings.smoothSamples = await sendCat(`${prefix}Smooth samples;`);\r\n\t\tsettings.recoveryDbPerSecond = await sendCat(`${prefix}Recovery db/s;`);\r\n\t\tsettings.sampleBlocks = await sendCat(`${prefix}Sample blocks;`);\r\n\t\tsettings.s9SoundsLikeS = await sendCat(`${prefix}S9 sounds like S;`);\r\n\t\treturn settings;\r\n\t}\r\n\tcatch (e) {\r\n\t\tconsole.error(\"Error loading AGC settings from radio:\", e);\r\n\t\treturn null;\r\n\t}\r\n};\r\n\r\nconst getDescriptionMarker = (activeIndex, length) => {\r\n\r\n\tlet out = \"\";\r\n\r\n\tfor (let i = 0; i < AGC_LIST.length; i++) {\r\n\t\tout += (i == activeIndex ? \"^\" : \"-\");\r\n\t}\r\n\r\n\treturn out;\r\n};\r\n\r\nconst formatSettings = (settings) => {\r\n\r\n\tlet out = \"\";\r\n\r\n\tObject.entries(settings).forEach(([key, value]) => {\r\n\t\tout += `${key}:\\t${value}\\n`;\r\n\t});\r\n\r\n\treturn out;\r\n};\r\n\r\nconst getVersionInfo = async () => {\r\n\tconst fwVersion = await sendCat(\"VN;\");\r\n\tconst verParts = fwVersion.match(/\\d+/g).map(Number);\r\n\r\n\treturn {\r\n\t\tmajor: parseInt(verParts[0]),\r\n\t\tminor: parseInt(verParts[1]),\r\n\t\tpatch: parseInt(verParts[2])\r\n\t}\r\n};\r\n\r\ntry{ \r\n\tconst lastIndex = parseInt(Storage.get(\"lastIndex\"));\r\n\tconst index = getNext(lastIndex, AGC_LIST);\r\n\tStorage.set(\"lastIndex\", index);\r\n\r\n\tconst settings = AGC_LIST[index];\r\n\tapplyAGCSettings(settings);\r\n\r\n\tsetTitle(`${context.task.title}: [${settings.name}]`);\r\n\t\r\n\tconst versionInfo = await getVersionInfo();\r\n\tlet versionWarning = \"\";\r\n\tif( versionInfo.minor >= 4 ){\r\n\t\tawait sendCat(\"MU;\");\r\n\t}\r\n\telse{\r\n\t\tversionWarning = \"Note: AGC settings may not apply until radio is restarted or \" + \r\n\t\t\t\t\"menu is entered and exited.  Update to firmware v1.04 \" + \r\n\t\t\t\t\"or later to load automatically.\";\r\n\t}\r\n\r\n\tconst activeMarker = getDescriptionMarker(index, AGC_LIST.length);\r\n\tconst formattedSettings = formatSettings(settings);\r\n\t\r\n\tsetDescription(`${context.task.description} ${activeMarker}\\n` + \r\n\t\t`${formattedSettings}\\n\\n${versionWarning}`);\r\n\r\n}\r\ncatch (e) {\r\n\tconsole.error(\"Error applying AGC settings:\", e);\r\n\tsetDescription(`${context.task.description}\\nError applying AGC settings: ${e.message}`);\r\n}",
  "autoRunOnConnect": false,
  "autoRunPriority": 0,
  "autoLock": false,
  "runLocked": false,
  "color": "#22c55e"
}
