{
  "title": "Scan",
  "description": "Scan the current band",
  "script": "console.log(\"scan script loaded\");\r\n\r\nconst FREQ_STEP = 100; // 100Hz step, adjust as needed\r\nconst SCAN_SPEED = 100; // 100ms between frequency changes, adjust as needed\r\nconst TX_MONITOR_INTERVAL = 100; // 100ms between TX status checks, adjust as needed\r\nconst STOP_ON_TX = true; // stop scanning when transmission is detected\r\n\r\nlet freq =0;\r\nlet vfo;\r\nlet scanActive = false;\r\n\r\nlet scanTimerId;\r\nlet txMonitorTimerId;\r\n\r\nlet resume;\r\n\r\nconst getState = () => {\r\n\r\n\treturn sendCat(\"IF;\")\r\n\t\t.then( status => {\r\n\r\n\t\t\tconst regex = /IF(\\d{11}).{17}(\\d)/;\r\n\t\t\tconst match = status.match(regex);\r\n\r\n\t\t\tif (match) {\r\n\t\t\t\tfreq = parseInt(match[1]);\r\n\t\t\t\tvfo = parseInt(match[2]) == 0 ? \"A\" : \"B\";\r\n\t\t\t\tlog(`IF: ${freq} Hz, VFO: ${vfo}`);\r\n\r\n\t\t\t} else {\r\n\t\t\t\tlog(\"Failed to parse IF status\");\r\n\t\t\t}\r\n\r\n\t\t\treturn true;\r\n\r\n\t\t});\r\n\r\n};\r\n\r\nconst setNextFreq = () => {\r\n\tfreq = freq + FREQ_STEP;\r\n\tsendCat(`F${vfo}${freq};`, false);\r\n};\r\n\r\nconst scan = () => {\r\n\t\r\n\tif( !scanActive ) {\r\n\t\treturn;\r\n\t}\r\n\r\n\tsetNextFreq();\r\n\t\r\n\t// Use recursive setTimeout to mitigate slower devices not keeping up \r\n\t// with the scan speed when using setInterval\r\n\tscanTimerId = task.setTimeout(() => {\r\n\t\tscan();\r\n\t}, SCAN_SPEED);\r\n};\r\n\r\nconst monitorTx = () => {\r\n\t\r\n\tconst checkTxStatus = () => {\r\n\t\tsendCat(\"TQ;\").then( status => {\r\n\t\t\tif( status.substring(2) === \"1\") {\r\n\t\t\t\tlog(\"Transmission detected, stopping scan\");\r\n\t\t\t\tresume();\r\n\t\t\t\tcancelScan();\r\n\t\t\t}\r\n\r\n\t\t\tif (scanActive) {\r\n\t\t\t\ttxMonitorTimerId = task.setTimeout(checkTxStatus, \r\n\t\t\t\t\tTX_MONITOR_INTERVAL);\r\n\t\t\t}\r\n\t\t});\r\n\t};\r\n\t\r\n\tcheckTxStatus();\r\n};\r\n\r\nconst cancelScan = () => {\r\n\tscanActive = false;\r\n\ttask.clearTimeout(scanTimerId);\r\n\ttask.clearTimeout(txMonitorTimerId);\r\n}\r\n\r\nconst runner = Promise.resolve()\r\n\t.then( getState )\r\n\t.then( () => { if (STOP_ON_TX) monitorTx(); } )\r\n\t.then( ()=> {\r\n\t\tscanActive = true;\r\n\t\tscan();\r\n\r\n\t\tconst cancelPromise = new Promise((resolve) => {\r\n\t\t\tresume = resolve;\r\n\t\t});\r\n\r\n\t\treturn pause('stop', '', cancelPromise);\r\n\t})\r\n\t.finally( ()=> {\r\n\t\tcancelScan();\r\n\t});\r\n\t\r\n\ttask.waitUntil(runner);",
  "autoRunOnConnect": false,
  "autoRunPriority": 0,
  "autoLock": false,
  "runLocked": false
}
