{
  "title": "SWR Tune",
  "description": "Place the radio into SWR mode, and display the SWR",
  "script": "console.log(\"Tune script\");\r\n\r\nconst saveSettings = async () => {\r\n\t/*\r\n\r\n\tIF\r\n\t00021044020     +00000000006000000 \r\n\t00021044020\r\n\t-----\r\n\t+0000\r\n\t0000006000000 \r\n\t\r\n\t0-10 digits: IF frequency in Hz\t\t\t00021044020\r\n\t11-15 N/A (Spaces)\t\t\t\t\t\t-----\r\n\t16-20 RIT offset in Hz (signed)\t\t\t+0000\r\n\t21 RIT status (0=off, 1=on)\t\t \t\r\n\t22 XIT status (0=off, 1=on)\r\n\t23-25 N/A\r\n\t26 TX Status (0=RX, 1=TX)\r\n\t27 MODE\r\n\t28 RX VFO (0=A, 1=B)\r\n\t29 N/A\r\n\t30 Split status (0=off, 1=on)\r\n\t31-32 N/A\r\n\t33 N/A (Space)\r\n\t*/\r\n\r\n\tconst rawIF = (await sendCat(`IF;`)).substring(2);\r\n\tfreq = rawIF.substring(0,10);\r\n\tvfo = rawIF.substring(28,29) == \"0\" ? \"A\" : \"B\";\r\n\tmode = rawIF.substring(27,28);\r\n\r\n\tconsole.log(`Saved settings - Freq: ${freq}, VFO: ${vfo}, Mode: ${mode}`);\r\n}\r\n\r\nconst revertSettings = () => {\r\n\tsendCat(`MD${mode};`, false);\r\n};\r\n\r\nconst printSWR = async () => {\r\n\tconst raw = (await sendCat('SW;')).substring(2);\r\n\tlet val = raw / 100;\r\n\tprint( `${dispFreq}\\n${val.toFixed(1)}` );\r\n};\r\n\r\nconst getBand = (freq) => {\r\n\tconst band = Math.floor(freq / 100000);\r\n\treturn `${band} MHz`;\r\n};\r\n\r\nconst tuneSetup = async () => {\r\n\tawait saveSettings();\r\n};\r\n\r\nconst tuneStart = () => {\r\n\tsendCat('MD8;', false); // SWR\r\n};\r\n\r\nconst tuneStop = async () => {\r\n\tsendCat(`MD${mode};`, false);\r\n}\r\n\r\nconst tuneTeardown = () => {\r\n\ttask.clearInterval(interval);\r\n\trevertSettings();\r\n};\r\n\r\nconst getFirmwareVersion = async () => {\r\n\tconst versionText = await sendCat(\"VN;\");  // 1_04_003QMX;\r\n\tconst parts = versionText.split(\"_\");\r\n\tconst major = parseInt(parts[0].substring(2));\r\n\tconst minor = parseInt(parts[1]);\r\n\tconst patch = parseInt(parts[2].substring(0,3));\r\n\r\n\treturn [major,minor,patch];\r\n}\r\n\r\nconst isFirmwareOk = (fwVersion, checkVersion) => {\r\n\r\n\tconst invalidCheckVersion = () => {\r\n\t\tconsole.error( `Invalid firmware check version: ${checkVersion}`)\r\n\t};\r\n\r\n\tif( checkVersion.length < 3){\r\n\t\tinvalidCheckVersion();\r\n\t}\r\n\r\n\tfor( let cI=0; cI<fwVersion.length; cI++ ) {\r\n\t\tif( isNaN(checkVersion[cI])) {\r\n\t\t\tinvalidCheckVersion();\r\n\t\t}\r\n\t\tif( fwVersion[cI] < checkVersion[cI] ) return false;\r\n\t}\r\n\r\n\treturn true;\r\n}\r\n\r\nconst prerunCheck = async () => {\r\n\r\n\tconst fwVersion = await getFirmwareVersion();\r\n\tconst reqFw = [1,4,3];\r\n\tif( !isFirmwareOk(fwVersion, reqFw)) {\r\n\t\tsetDescription(\"ERROR: This script requires firmware >= \" + \r\n\t\t\treqFw.join(\".\"));\r\n\t\treturn false;\r\n\t}\r\n\r\n\treturn true;\r\n\r\n}\r\n\r\nlet interval, freq, vfo, mode, power, vol, dispFreq;\r\n\r\nif( !(await prerunCheck())) return;\r\n\r\nawait tuneSetup();\r\n\r\ndispFreq = getBand(freq);\r\ninterval = task.setInterval(printSWR, 500);\r\n\r\nawait tuneStart();\r\nawait pause('stop', '#D63031');\r\nawait tuneStop();\r\n\r\ntuneTeardown();",
  "autoRunOnConnect": false,
  "autoRunPriority": 0,
  "autoLock": false,
  "runLocked": false
}
