{
  "title": "Message tuning",
  "description": "Tune a range of frequencies from message 10",
  "script": "/*\r\n\r\nMMMessages|Message 10=7032020|10114020|14044020|18088020|21044020\r\n\r\n*/\r\n\r\nconst MMINDEX_MAX_PA_V = 'MMProtection|Max. PA voltage';\r\nconst MMINDEX_FREQ_LIST = 'MMMessages|Message 10';\r\nconst PA_V_TUNE = 5.00;\r\nconst PA_V_OPERATE = 11.5;\r\n\r\nlet interval, vfo, mode, power, dispFreq;\r\n\r\nconst saveSettings = async () => {\r\n\t\r\n\t/*\r\n\t0-10 digits: IF frequency in Hz\r\n\t11-16 N/A (Spaces)\r\n\t17-22 RIT offset in Hz (signed)\r\n\t23 RIT status (0=off, 1=on)\r\n\t24 XIT status (0=off, 1=on)\r\n\t25-27 N/A\r\n\t28 TX Status (0=RX, 1=TX)\r\n\t29 MODE\r\n\t30 RX VFO (0=A, 1=B)\r\n\t31 N/A\r\n\t32 Split status (0=off, 1=on)\r\n\t33-34 N/A\r\n\t35 N/A (Space)\r\n\t*/\r\n\r\n\tconst rawIF = await sendCat(`IF;`);\r\n\tvfo = rawIF.substring(30,31) == \"0\" ? \"A\" : \"B\";\r\n\tmode = rawIF.substring(29,30);\r\n\r\n\tpower = (await sendCat(`${MMINDEX_MAX_PA_V};`)).substring(2);\r\n}\r\n\r\nconst revertSettings = () => {\r\n\tsendCat(`MD${mode};`, false);\r\n\tsendCat(`${MMINDEX_MAX_PA_V}=${PA_V_OPERATE};`, false);\r\n};\r\n\r\nconst printSWR = async () => {\r\n\tconst raw = (await sendCat('SW;')).substring(2);\r\n\tlet val = raw / 100;\r\n\tprint( `${dispFreq}\\n${val.toFixed(1)}` );\r\n};\r\n\r\nconst setBand = (freq) => {\r\n\tconst band = Math.floor(freq / 1000000);\r\n\treturn `${band} MHz`;\r\n};\r\n\r\nconst tuneSetup = async () => {\r\n\tawait saveSettings();\r\n\tsendCat(`${MMINDEX_MAX_PA_V}=${PA_V_TUNE};`, false);\r\n\tsendCat('MD6;', false); // FSK\r\n};\r\n\r\nconst tuneStart = () => {\r\n\tsendCat('TX;', false);\r\n\tsendCat('TA500;', false);\r\n};\r\n\r\nconst tuneStop = () => {\r\n\tsendCat('TA0;', false);\r\n\tdelay(6);\r\n\tsendCat('RX;', false);\r\n}\r\n\r\nconst tuneTeardown = () => {\r\n\ttask.clearInterval(interval);\r\n\trevertSettings();\r\n};\r\n\r\nconst retrieveFrequencies = async () => {\r\n\tconst raw = (await sendCat(`${MMINDEX_FREQ_LIST};`)).substring(2);\r\n\treturn raw.split('|')\r\n\t\t.map(f => f.trim())\r\n\t\t.filter(f => /^\\d+$/.test(f));\r\n};\r\n\r\nconst freqList = await retrieveFrequencies();\r\n\r\nawait tuneSetup();\r\ninterval = task.setInterval(printSWR, 500);\r\n\r\nfor( const freq of freqList ) {\r\n\tdispFreq = setBand(freq);\r\n\tawait sendCat(`F${vfo}${freq};`, false);\r\n\tawait tuneStart();\r\n\tawait pause('play-pause', '#D63031');\r\n\tawait tuneStop();\t\r\n}\r\n\r\ntuneTeardown();",
  "autoRunOnConnect": false,
  "autoRunPriority": 0,
  "autoLock": false,
  "runLocked": false
}
