{
  "title": "SWR Tune - Cycle",
  "description": "Cycle through a list of frequencies, showing SWR for each.",
  "script": "console.log(\"Cycle Tune script\");\r\n\r\nconst FREQ_SRC = \"SCRIPT\"; // MSG | SCRIPT\r\nconst MESSAGE_INDEX = 10;\r\nconst FREQ_LIST = [\r\n\t7032000,\r\n\t14044000,\r\n\t21044000\r\n];\r\n\r\nconst getFreqList = async () => {\r\n\t\r\n\tswitch (FREQ_SRC) {\r\n\t\tcase \"MSG\":\r\n\t\t\treturn await getFreqListFromMessage(MESSAGE_INDEX);\r\n\t\tcase \"SCRIPT\":\r\n\t\t\treturn FREQ_LIST;\r\n\t\tdefault:\r\n\t\t\tthrow new Error(`Invalid FREQ_SRC: ${FREQ_SRC}`);\r\n\t}\r\n}\r\n\r\nconst getFreqListFromMessage = async (index) => {\r\n\t\r\n\tconst raw = (await sendCat(`MMMessages|Message ${index};`)).substring(2);\r\n\treturn raw.split('|')\r\n\t\t.map(f => f.trim())\r\n\t\t.filter(f => /^\\d+$/.test(f));\r\n}\r\n\r\nconst saveSettings = async () => {\r\n\t\r\n\t/*\r\n\t0-10 digits: IF frequency in Hz\r\n\t11-16 N/A (Spaces)\r\n\t17-22 RIT offset in Hz (signed)\r\n\t23 RIT status (0=off, 1=on)\r\n\t24 XIT status (0=off, 1=on)\r\n\t25-27 N/A\r\n\t28 TX Status (0=RX, 1=TX)\r\n\t29 MODE\r\n\t30 RX VFO (0=A, 1=B)\r\n\t31 N/A\r\n\t32 Split status (0=off, 1=on)\r\n\t33-34 N/A\r\n\t35 N/A (Space)\r\n\t*/\r\n\r\n\tconst rawIF = await sendCat(`IF;`);\r\n\tfreq = rawIF.substring(2,13);\r\n\tvfo = rawIF.substring(30,31) == \"0\" ? \"A\" : \"B\";\r\n\tmode = rawIF.substring(29,30);\r\n\t\r\n\tconsole.log(`Saved settings - Freq: ${freq}, VFO: ${vfo}, Mode: ${mode}`);\r\n}\r\n\r\nconst getFirmwareVersion = async () => {\r\n\tconst versionText = await sendCat(\"VN;\");  // 1_04_003QMX;\r\n\tconst parts = versionText.split(\"_\");\r\n\tconst major = parseInt(parts[0].substring(2));\r\n\tconst minor = parseInt(parts[1]);\r\n\tconst patch = parseInt(parts[2].substring(0,3));\r\n\r\n\treturn [major,minor,patch];\r\n}\r\n\r\nconst isFirmwareOk = (fwVersion, checkVersion) => {\r\n\r\n\tconst invalidCheckVersion = () => {\r\n\t\tconsole.error( `Invalid firmware check version: ${checkVersion}`)\r\n\t};\r\n\r\n\tif( checkVersion.length < 3){\r\n\t\tinvalidCheckVersion();\r\n\t}\r\n\r\n\tfor( let cI=0; cI<fwVersion.length; cI++ ) {\r\n\t\tif( isNaN(checkVersion[cI])) {\r\n\t\t\tinvalidCheckVersion();\r\n\t\t}\r\n\t\tif( fwVersion[cI] < checkVersion[cI] ) return false;\r\n\t}\r\n\r\n\treturn true;\r\n}\r\n\r\nconst revertSettings = () => {\r\n\tsendCat(`MD${mode};`, false);\r\n\tsendCat(`F${vfo}${freq};`, false);\r\n};\r\n\r\nconst printSWR = async () => {\r\n\tconst raw = (await sendCat('SW;')).substring(2);\r\n\tlet val = raw / 100;\r\n\tprint( `${dispFreq}\\n${val.toFixed(1)}` );\r\n};\r\n\r\nconst getBand = (freq) => {\r\n\tconst band = Math.floor(freq / 1000000);\r\n\treturn `${band} MHz`;\r\n};\r\n\r\nconst tuneSetup = async () => {\r\n\tawait saveSettings();\r\n};\r\n\r\nconst tuneStart = () => {\r\n\tsendCat('MD8;', false); // SWR\r\n};\r\n\r\nconst tuneStop = () => {\r\n\tsendCat(`MD${mode};`, false);\r\n}\r\n\r\nconst tuneTeardown = () => {\r\n\ttask.clearInterval(interval);\r\n\trevertSettings();\r\n};\r\n\r\nconst prerunCheck = async () => {\r\n\r\n\tconst fwVersion = await getFirmwareVersion();\r\n\r\n\tif( !isFirmwareOk(fwVersion, [1,4,3])) {\r\n\t\tsetDescription(\"ERROR: This script requires firmware >= 1.4.3\");\r\n\t\treturn false;\r\n\t}\r\n\r\n\treturn true;\r\n\r\n}\r\n\r\nlet interval, freq, vfo, mode, dispFreq;\r\n\r\nif( !(await prerunCheck())) return;\r\n\r\nconst freqList = await getFreqList();\r\n\r\nawait tuneSetup();\r\n\r\ninterval = task.setInterval(printSWR, 500);\r\n\r\nfor( const tFreq of freqList ) {\r\n\tdispFreq = getBand(tFreq);\r\n\tsendCat(`F${vfo}${tFreq};`, false);\r\n\tawait tuneStart();\r\n\tawait pause('play-pause', '#D63031');\r\n\tawait tuneStop();\r\n}\r\n\r\ntuneTeardown();",
  "autoRunOnConnect": false,
  "autoRunPriority": 0,
  "autoLock": false,
  "runLocked": false
}
