{
  "title": "Cycle Ops Config",
  "description": "Cycle operational configurations",
  "script": "console.log(\"Cycle Ops Config\");\r\n\r\nconst CONFIG_LIST = [\r\n\t{name: \"CW\", mode: \"CW\", vfo: \"A\", maxVoltage: 11.5, vox: false, keyerSpeed: 20},\r\n\t\r\n\t{name: \"SSB\", mode: \"LSB\", vfo: \"A\", maxVoltage: 11.5, ssbAutoSb: true, \r\n\t\tssbVox: false, ssbInput: \"Ext. mic\"},\r\n\t\r\n\t{name: \"SSTV\", mode: \"LSB\", vfo: \"A\", maxVoltage: 8, ssbAutoSb: false, \r\n\t\tssbVox: true, ssbVoxThreshold: 22, ssbVoxHoldTime: 11, ssbDriveLevel: 900, \r\n\t\tssbInput: \"USB\"},\t\r\n\t\r\n\t{name: \"FT*\", mode: \"DIGI\", vfo: \"A\", maxVoltage: 8, digiVox: true,\r\n\t\tdigiSideband: \"USB\"},\r\n\t\r\n];\r\n\r\nconst getNextConfigIndex = () => {\r\n\t\r\n\tlet index = parseInt(Storage.get(\"configIndex\"));\r\n\tindex = isNaN(index) ? 0 : index;\r\n\tindex = (index + 1) % CONFIG_LIST.length;\r\n\r\n\tconsole.log(`Using config index ${index}`);\r\n\tStorage.set(\"configIndex\", index);\r\n\r\n\treturn index;\r\n};\r\n\r\nconst appendTitle = (configName) => {\r\n\tconst baseTitle = context.task.title.split(\"[\")[0].trim();\r\n\tcontext.task.title = `${baseTitle} [${configName}]`;\r\n\r\n\tsetTitle(`${baseTitle} [${configName}]`);\r\n};\r\n\r\nconst setMode = (mode) => {\r\n\t\r\n\tconst modes = {\r\n\t\tLSB: 1,\r\n\t\tUSB: 2,\r\n\t\tCW: 3,\r\n\t\tDIGI: 6,\r\n\t\tCWR: 7,\r\n\t\tDIGIR: 9\r\n\t}\r\n\r\n\tif( mode === undefined) return;\r\n\tif( !Object.keys(modes).includes(mode.toUpperCase())) return;\r\n\r\n\twriteCat(`MD${modes[mode.toUpperCase()]};`, false);\r\n\t\r\n};\r\n\r\nconst setSsbAutoSb = (autoSSB) => {\r\n\t\r\n\tif( autoSSB === undefined) return;\r\n\tif( typeof autoSSB !== \"boolean\") return;\r\n\r\n\twriteCat(`MMSSB|Band auto U/LSB=${autoSSB ? \"YES\" : \"NO\"};`, false);\r\n};\r\n\r\nconst setVfo = (vfoStr) => {\r\n\t\r\n\tconst validVfos = {\r\n\t\tA: 0,\r\n\t\tB: 1,\r\n\t\tSPLIT: 2,\r\n\t};\r\n\r\n\tif( vfoStr === undefined) return;\r\n\tif( !Object.keys(validVfos).includes(vfoStr)) return;\r\n\t\r\n\tconst vfo = validVfos[vfoStr];\r\n\r\n\twriteCat(`FR${vfo};`, false);\r\n};\r\n\r\nconst setMaxPaVoltage = (maxVoltage) => {\r\n\t\r\n\tif( maxVoltage == undefined) return;\r\n\tif( isNaN(maxVoltage)) return;\r\n\r\n\twriteCat(`MMProtection|Max. PA voltage=${maxVoltage};`, false);\r\n};\r\n\r\nconst setKeyerSpeed = (keyerSpeed) => {\r\n\t\r\n\tif( keyerSpeed == undefined) return;\r\n\tif( isNaN(keyerSpeed)) return;\r\n\r\n\twriteCat(`KS${keyerSpeed};`, false);\r\n};\r\n\r\nconst setSsbVox = (ssbVox) => {\r\n\t\r\n\tif( ssbVox === undefined) return;\r\n\tif( typeof ssbVox !== \"boolean\") return;\r\n\r\n\twriteCat(`Q3${ssbVox ? \"1\" : \"0\"};`, false);\r\n};\r\n\r\nconst setSsbVoxThreshold = (ssbVoxThreshold) => {\r\n\tif( ssbVoxThreshold === undefined) return;\r\n\tif( isNaN(ssbVoxThreshold)) return;\r\n\r\n\twriteCat(`MMSSB|VOX|VOX threshold=${ssbVoxThreshold};`, false);\r\n};\r\n\r\nconst setSsbVoxHoldTime = (ssbVoxHoldTime) => {\r\n\tif( ssbVoxHoldTime === undefined) return;\r\n\tif( isNaN(ssbVoxHoldTime)) return;\r\n\r\n\twriteCat(`MMSSB|VOX|VOX hold time=${ssbVoxHoldTime};`, false);\r\n};\r\n\r\nconst setSsbDriveLevel = (ssbDriveLevel) => {\r\n\tif( ssbDriveLevel === undefined) return;\r\n\tif( isNaN(ssbDriveLevel)) return;\r\n\r\n\twriteCat(`MMSSB|Drive level=${ssbDriveLevel};`, false);\r\n};\r\n\r\nconst setSsbInput = (ssbInput) => {\r\n\tif( ssbInput === undefined) return;\r\n\r\n\tconst options = [\"USB\", \"Two-tone\", \"Ext. mic\", \"Auto\"];\r\n\tif( !options.includes(ssbInput)) return;\r\n\r\n\twriteCat(`MMSSB|Input=${ssbInput};`, false);\r\n};\r\n\r\nconst setDigiVox = (digiVox) => {\r\n\t\r\n\tif( digiVox === undefined) return;\r\n\tif( typeof digiVox !== \"boolean\") return;\r\n\r\n\twriteCat(`MMDigi|VOX${digiVox ? \"ON\" : \"OFF\"};`, false);\r\n};\r\n\r\nconst setDigiSideband = (digiSideband) => {\r\n\tif( digiSideband === undefined) return;\r\n\r\n\tconst options = [\"USB\", \"LSB\"];\r\n\tif( !options.includes(digiSideband)) return;\r\n\r\n\twriteCat(`MMDigi|Sideband=${digiSideband};`, false);\r\n};\r\n\r\nconst writeCat = async (command, waitForResponse) => {\r\n\t\r\n\tconsole.log(`Sending CAT command: ${command}`);\r\n\tawait sendCat(command, false);\r\n}\r\n\r\nconst index = getNextConfigIndex();\r\nconst config = CONFIG_LIST[index];\r\n\r\nsetMode(config.mode);\r\nsetVfo(config.vfo);\r\nsetMaxPaVoltage(config.maxVoltage);\r\nsetKeyerSpeed(config.keyerSpeed);\r\n\r\nsetSsbVox(config.ssbVox);\r\nsetSsbVoxThreshold(config.ssbVoxThreshold);\r\nsetSsbVoxHoldTime(config.ssbVoxHoldTime);\r\nsetSsbDriveLevel(config.ssbDriveLevel);\r\nsetSsbAutoSb(config.ssbAutoSb);\r\nsetSsbInput(config.ssbInput);\r\n\r\nsetDigiVox(config.digiVox);\r\nsetDigiSideband(config.digiSideband);\r\n\r\nappendTitle(config.name);\r\nsetDescription(CONFIG_LIST.map(v => v.name).join(\" | \"));",
  "autoRunOnConnect": false,
  "autoRunPriority": 0,
  "autoLock": false,
  "runLocked": false
}
