{
  "title": "Scan - COA",
  "description": "Scan around centre of activity (COA) frequencies",
  "script": "console.log(\"COA scan script loaded\");\r\n\r\nconst FREQ_LIST =[7032000, 10114000, 14044000, 18088000, 21044000];\r\nconst SCAN_SPAN = 3000; // Hz span around each frequency to scan, adjust as needed\r\nconst FREQ_STEP = 100; // 100Hz step, adjust as needed\r\nconst SCAN_SPEED = 100; // 100ms between frequency changes, adjust as needed\r\nconst TX_MONITOR_INTERVAL = 100; // 100ms between TX status checks, adjust as needed\r\nconst STOP_ON_TX = true; // stop scanning when transmission is detected\r\n\r\nlet freq =0;\r\nlet vfo;\r\nlet scanActive = false;\r\n\r\nlet scanTimerId;\r\nlet txMonitorTimerId;\r\n\r\nlet resume;\r\n\r\nfunction* scanFreqList( initIndex, initFreq) {\r\n\r\n\tlet index = initIndex || 0;\r\n\r\n\twhile(true) {\r\n\t\tconst endFreq = getCoaEnd(index);\r\n\t\t\r\n\t\tlet startFreq;\r\n\t\tif( initFreq ) {\r\n\t\t\tstartFreq = initFreq;\r\n\t\t\tinitFreq = null; // only use initial frequency for the first scan\r\n\t\t}\r\n\t\telse{\r\n\t\t\tstartFreq = getCoaStart(index);\r\n\t\t}\r\n\r\n\t\tfor( let freq = startFreq; freq <= endFreq; freq += FREQ_STEP) {\r\n\t\t\tyield freq;\r\n\t\t}\r\n\r\n\t\tindex = (index + 1) % FREQ_LIST.length;\r\n\t}\r\n\r\n}\r\n\r\nconst getCoaStart = (coaIndex) => {\r\n\treturn FREQ_LIST[coaIndex] - SCAN_SPAN;\r\n}\r\n\r\nconst getCoaEnd = (coaIndex) => {\r\n\treturn FREQ_LIST[coaIndex] + SCAN_SPAN;\r\n}\r\n\r\nconst findStartIndexAndFreq = () => {\r\n\r\n\tlet index; freq;\r\n\r\n\tfor( let i = 0; i < FREQ_LIST.length; i++) {\r\n\t\tif( Math.floor(FREQ_LIST[i] / 1000000) == Math.floor(freq / 1000000) ) {\r\n\t\t\tindex = i;\r\n\r\n\t\t\tif( freq < getCoaStart(i) || freq > getCoaEnd(i) ) {\r\n\t\t\t\tfreq = getCoaStart(i);\r\n\t\t\t}\r\n\r\n\t\t\tbreak;\r\n\t\t}\r\n\t};\r\n\r\n\t// if current frequency doesn't match any COA, start with the first one\r\n\tindex = freq ? index : 0; \r\n\r\n\treturn { index, freq };\r\n}\r\n\r\n\r\nconst getState = () => {\r\n\r\n\treturn sendCat(\"IF;\")\r\n\t\t.then( status => {\r\n\r\n\t\t\tconst regex = /IF(\\d{11}).{17}(\\d)/;\r\n\t\t\tconst match = status.match(regex);\r\n\r\n\t\t\tif (match) {\r\n\t\t\t\tfreq = parseInt(match[1]);\r\n\t\t\t\tvfo = parseInt(match[2]) == 0 ? \"A\" : \"B\";\r\n\t\t\t\tlog(`IF: ${freq} Hz, VFO: ${vfo}`);\r\n\r\n\t\t\t} else {\r\n\t\t\t\tlog(\"Failed to parse IF status\");\r\n\t\t\t}\r\n\r\n\t\t\treturn true;\r\n\r\n\t\t});\r\n\r\n};\r\n\r\nconst startScan = (freqGenerator) => {\r\n\t\tconst nextFreq = freqGenerator.next().value;\r\n\t\tsendCat(`F${vfo}${nextFreq};`, false);\r\n\r\n\t\tif( !scanActive ) {\r\n\t\t\treturn;\r\n\t\t}\r\n\t\t\r\n\t\t// Use recursive setTimeout to mitigate slower devices not keeping up \r\n\t\t// with the scan speed when using setInterval\r\n\t\tscanTimerId = task.setTimeout(() => {\r\n\t\t\tstartScan(freqGenerator);\r\n\t\t}, SCAN_SPEED);\r\n\t};\r\n\r\nconst scan = () => {\r\n\t\r\n\tconst initValues = findStartIndexAndFreq();\r\n\tconst freqGenerator = scanFreqList(initValues.index, initValues.freq);\r\n\t\r\n\tscanActive = true;\r\n\tstartScan(freqGenerator);\r\n};\r\n\r\nconst monitorTx = () => {\r\n\t\r\n\tconst checkTxStatus = () => {\r\n\t\tsendCat(\"TQ;\").then( status => {\r\n\t\t\tif( status.substring(2) === \"1\") {\r\n\t\t\t\tlog(\"Transmission detected, stopping scan\");\r\n\t\t\t\tresume();\r\n\t\t\t\tcancelScan();\r\n\t\t\t}\r\n\r\n\t\t\tif (scanActive) {\r\n\t\t\t\ttxMonitorTimerId = task.setTimeout(checkTxStatus, \r\n\t\t\t\t\tTX_MONITOR_INTERVAL);\r\n\t\t\t}\r\n\t\t});\r\n\t};\r\n\t\r\n\tcheckTxStatus();\r\n};\r\n\r\nconst cancelScan = () => {\r\n\tscanActive = false;\r\n\ttask.clearTimeout(scanTimerId);\r\n\ttask.clearTimeout(txMonitorTimerId);\r\n}\r\n\r\nconst runner = Promise.resolve()\r\n\t.then( getState )\r\n\t.then( () => {\r\n\t\tif (STOP_ON_TX) {\r\n\t\t\treturn monitorTx();\r\n\t\t}\r\n\t})\r\n\t.then( ()=> {\r\n\t\tscan();\r\n\r\n\t\tconst cancelPromise = new Promise((resolve) => {\r\n\t\t\tresume = resolve;\r\n\t\t});\r\n\r\n\t\treturn pause('stop', '', cancelPromise);\r\n\t})\r\n\t.finally( ()=> {\r\n\t\tcancelScan();\r\n\t});\r\n\t\r\n\ttask.waitUntil(runner);",
  "autoRunOnConnect": false,
  "autoRunPriority": 0,
  "autoLock": false,
  "runLocked": false
}
