{
  "title": "Cycle SSTV Freqs",
  "description": "Cycle through SSTV frequencies",
  "script": "console.log(\"Cycle SSTV Freqs\");\r\n\r\nconst FREQ_LIST = [\r\n\t3.640,\r\n\t7.171, \r\n\t14.233, \r\n\t21.340, \r\n\t24.927, \r\n\t28.680\r\n];\r\n\r\nconst getVfo = async () => {\r\n\tconst rawIF = (await sendCat(`IF;`)).substring(2);\r\n\tconst vfo = rawIF.substring(28,29) == \"0\" ? \"A\" : \"B\";\r\n\treturn vfo;\r\n}\r\n\r\nconst getBands = async () => {\r\n\t\r\n\tconst bandList = [];\r\n\r\n\tfor( let cI=0; cI<15; cI++) {\r\n\t\ttry{\r\n\t\t\tconst transmitStatus = await sendCat(`MMBand config.|Transmit[${cI}];`)\r\n\t\t\tif( transmitStatus == \"MMENABLED\") {\r\n\t\t\t\tconst bandName = (await sendCat(`MMBand config.|Band name (m)[${cI}];`)).substring(2);\r\n\t\t\t\tconst freqMin = (await sendCat(`MMBand config.|Frequency min.[${cI}];`)).substring(2);\r\n\t\t\t\tconst freqMax = (await sendCat(`MMBand config.|Frequency max.[${cI}];`)).substring(2);\r\n\t\t\t\tbandList.push({\r\n\t\t\t\t\tbandName,\r\n\t\t\t\t\tfreqMin,\r\n\t\t\t\t\tfreqMax\r\n\t\t\t\t});\r\n\t\t\t}\r\n\t\t}\tcatch(e) {\r\n\t\t\tconsole.warn(`Error checking band index ${cI}:`, e);\r\n\t\t}\r\n\t}\r\n\r\n\treturn bandList;\r\n}\r\n\r\nconst isInSupportedBand = (freq, bandList) => {\r\n\r\n\tfor( let bI=0; bI<bandList.length; bI++) {\r\n\t\tif( freq >= bandList[bI].freqMin && freq <= bandList[bI].freqMax) {\r\n\t\t\treturn true;\r\n\t\t}\r\n\t}\r\n\r\n\treturn false;\r\n}\r\n\r\nconst getNextFreqIndex = (lastIndex, bandList) => {\r\n\tlet index = isNaN(lastIndex) ? 0 : lastIndex;\r\n\t\r\n\tfor( let i=0; i<FREQ_LIST.length; i++) {\r\n\t\tindex = (index + 1) % FREQ_LIST.length;\r\n\r\n\t\tif( isInSupportedBand(FREQ_LIST[index]*1000000, bandList)) {\r\n\t\t\tbreak;\r\n\t\t}\r\n\r\n\t}\r\n\treturn index;\r\n}\r\n\r\n\r\nconst lastIndex = parseInt(Storage.get(\"freqIndex\"));\r\n\r\nconst bandList = await getBands();\r\nconst index = getNextFreqIndex(lastIndex, bandList);\r\n\r\nStorage.set(\"freqIndex\", index);\r\n\r\nconst vfo = await getVfo();\r\nconst freq = FREQ_LIST[index] * 1000000;\r\n\r\nsendCat(`F${vfo}${freq};`, false);\r\n\r\nconst mode = freq < 14000000 ? \"1\" : \"2\";\r\nsendCat(`MD${mode};`, false);",
  "autoRunOnConnect": false,
  "autoRunPriority": 0,
  "autoLock": false,
  "runLocked": false
}
